Carimbo de data/hora;Nome completo:;Apelido/Nickname (nome de jogador);Data de nascimento (dd/mm/aaaa):;Apelido/Nickname (nome de jogador);RG ou CPF;WhatsApp;Email;Cidade/Estado;"Foto de rosto (estilo ""card de jogador"")";Posição preferida;Lado dominante;Nível atual de jogo;Estilo de jogo (descreva com suas palavras);Clubes que já jogou ou joga atualmente;Experiência em torneios;Seu jogador profissional favorito;Time do coração;Seu apelido de jogador (estilo “El Mago”, “O Canhão”, etc.);Frase de impacto para te representar como jogador;Qual dessas opções mais combina com você em campo?;Instagram;TikTok (se tiver);?? Autorização de Imagem;Se você pudesse desbloquear uma função dentro do app da Royal Cup, qual seria a mais legal?;Se você tivesse acesso a um painel com suas estatísticas e comparações com outros jogadores, qual dessas coisas você mais gostaria de ver?;"Qual nome de usuário você usaria no futuro app da Royal Cup?
(Pense em algo único, como “lucas.br7” ou “felipekiller9”)";O que você mais quer ver nas redes sociais da Royal Cup?;"Você acha que um app com ranking, perfil de jogador, estatísticas, desafios e bastidores da liga seria maneiro?
";Quer dar uma ideia de função que você gostaria num app da Royal Cup?;Li e aceito os termos do regulamento da Royal Cup Rsports. ;Time que vai jogar;"Foto de rosto (estilo ""card de jogador"")"
5/16/2025 18:25:26;Rafael Kaczur Ferraro ;Ferraro;16/02/2006;fefe da galera;07288958973;46991407731;rafaeldao5100@gmail.com;Curitiba PR ;https://drive.google.com/open?id=1sOLK9xIQe8GTiv7LyaMGWSRM_tB8H5VH;Versátil;Pivô;Intermediário;Jogo limpo com características de um pivô que puxa marcação ;direito UP ;Pouca;ferreirinha;são Paulo ;abusado;não dá pra ganha todas, mas dá pra perder todas ;??? O Guerreiro – Marca sem parar, joga com o coração;rafael_ferraroo;;Autorizo o uso da minha imagem, voz e nome em vídeos, fotos e materiais de divulgação da Royal Cup Rsports, incluindo redes sociais, site, app e projetos futuros.;Ver minhas estatísticas ao vivo, Montar meu card de jogador personalizável;Comparativo com amigos e rivais, Meu desempenho histórico na Royal Cup;fefe.da.glr;Highlights dos jogos, Entrevistas e histórias dos jogadores, Tudo junto!;Sim, já quero instalar!;;Sim;direito UP ;
5/16/2025 23:37:24;Felipe Girhad De Araujo Saad;Saad;07/04/2007;Saad;10449503909;(41)998720024;girhad.saad@gmail.com;Curitiba;https://drive.google.com/open?id=1MhK-30-gI0OTmc-5R6f9N7pk7U0lG4L5;Versátil;Pé direito;Intermediário;Forte e com visão de jogo;União Capão Raso;Muita;Alex;Coritiba;Não tem;O Craque;??? O Guerreiro – Marca sem parar, joga com o coração;f.saad07;;Autorizo o uso da minha imagem, voz e nome em vídeos, fotos e materiais de divulgação da Royal Cup Rsports, incluindo redes sociais, site, app e projetos futuros.;Ver minhas estatísticas ao vivo, Participar de rankings com premiações, Acompanhar bastidores, lances e highlights da liga;Gols e assistências, Ranking de performance da rodada, Comparativo com amigos e rivais, Meu desempenho histórico na Royal Cup, Avaliação do meu jogo feita por inteligência artificial;felipe.saad07;Tudo junto!;Sim, já quero instalar!;;Sim;Atlética Positivo;
5/18/2025 16:24:26;Arthur Pereira de Castilho;Arthur;18/02/2004;Arthur;10754106659;41999571003;arthurpcastilho04@gmail.com;Curitiba;https://drive.google.com/open?id=1_gPg7eXm1E5-b7CZfpVjUkA0whB9Hj4F;Versátil;Pé direito;Iniciante;.;AAADUP;Pouca;Neymar;Atletico MG;.;.;?? O Maestro – Inteligente, arma o jogo, faz o time rodar;arthurpc__;.;Autorizo o uso da minha imagem, voz e nome em vídeos, fotos e materiais de divulgação da Royal Cup Rsports, incluindo redes sociais, site, app e projetos futuros.;Ver minhas estatísticas ao vivo, Participar de rankings com premiações, Acompanhar bastidores, lances e highlights da liga;Gols e assistências;arthurpc;Highlights dos jogos, Tudo junto!;Sim, já quero instalar!;.;Sim;Aaadup;
